	Unnamed: 0	Event_Type	Count	Sample_sentence	Trigger	Start	End	sentence_translation	trigger_translation
114	114	Conflict:Attack	74	这名就读国中一年级的女性学生右手大姆指和掌心之间被老师用木 条打成一青，原因是因为这名 女同学连续好几天延迟交作业，老 师为了让她顶替才会打了五下，出发点却完全为了她好。	打	1	2	The female student in the first grade of the junior high school was scored green with a wooden strip between the thumb thumb of her right hand and the palm of her hand, because the female student delayed her homework for several days in a row. After five attempts, the starting point was entirely for her.	hit
115	115	Conflict:Attack	74	这名就读国中一年级的女性学生右手大姆指和掌心之间被老师用木 条打成一青，原因是因为这名 女同学连续好几天延迟交作业，老 师为了让她顶替才会打了五下，出发点却完全为了她好。	打	7	8	The female student in the first grade of the junior high school was scored green with a wooden strip between the thumb thumb of her right hand and the palm of her hand, because the female student delayed her homework for several days in a row. After five attempts, the starting point was entirely for her.	hit
116	116	Conflict:Attack	74	至于打学生，老师已经向学生家长道歉，家长也谅解是因为自己小 孩犯错在先，不过校方为显公 平，将对这位老师适度处分。	打	0	1	As for beating students, the teacher has apologized to the student&#39;s parents, and the parents also understand that their children made mistakes first, but the school will punish the teacher appropriately for fairness.	hit
117	117	Conflict:Attack	74	新华社墨西哥城１２月３０日电（记者胡加齐）墨西哥恰帕斯州政 府３０日释放了首批１６名萨帕塔民族解放军武装组织成员，墨政 府在和平解决恰帕斯州武装冲突问题上又迈出了一步。	冲突	8	9	Xinhua News Agency, Mexico City, December 30 (Reporter Hu Gazi) The Mexican state of Chiapas released the first group of 16 members of the Zappata National Liberation Army on the 30th. Take a step.	conflict
118	118	Movement:Transport	99	两位领导人强烈谴责以色列军队对巴勒斯坦人民的挑衅行为和血腥 镇压，要求以色列军队迅速从它上月２９日以来占领的巴勒斯坦地 区撤离。	撤离	4	5	The two leaders strongly condemned the Israeli army&#39;s provocative actions and bloody crackdowns on the Palestinian people, and demanded that the Israeli army quickly withdraw from the Palestinian area it has occupied since last month.	Evacuate
119	119	Movement:Transport	99	新华社乌鲁木齐１０月８日电（记者孙彬）“奥运健儿祖国西部行 ”代表团今天中午飞抵新疆乌鲁木齐。	飞抵	7	8	Xinhua News Agency, Urumqi, October 8 (Reporter Sun Bin) A delegation from the &quot;Olympic athletes to the west of the motherland&quot; delegation arrived in Urumqi, Xinjiang at noon today.	Arrive
120	120	Movement:Transport	99	此次到达新疆的“奥运健儿祖国西部行”新疆团成员一行１４人， 由国家体育总局副局长李富荣带队，成员有蔡振华、葛飞、顾俊、 杨霞、王楠、李小鹏、刘国梁、凌洁、杨威、黄楠燕、刘国正、白 扬和阿不都热合曼。	到达	0	1	Fourteen members of the Xinjiang Regiment of the &quot;Olympic athletes&#39; motherland westward trip&quot; arrived in Xinjiang this time. They were led by Li Furong, deputy director of the General Administration of Sport of China. The members were Cai Zhenhua, Ge Fei, Gu Jun, Yang Xia, Wang Nan, Li Xiaopeng, Liu Guoliang, Ling Jie , Yang Wei, Huang Nanyan, Liu Guozheng, Bai Yang and Abdu are all reunited.	Arrivals
121	121	Movement:Transport	99	“奥运健儿祖国西部行”代表团在结束乌鲁木齐的活动后，将于１ １日前往南疆喀什。	前往	6	7	The delegation of &quot;Olympic athletes to the west of the motherland&quot; will end their activities in Urumqi and will travel to Kashgar, southern Xinjiang on the 11th.	Go to
122	122	Movement:Transport	99	彰化一名男子昨天晚上开着地的士轿车，结果是连人带车冲入路港 镇的一条大排水沟，救难人员 花了两个多小时搜寻才拉起了轿车 ，可惜男子已经溺毙了。	冲入	2	3	A man in Changhua drove a taxi in the ground last night. As a result, people rushed into a large drainage ditch in Lugang Town. It took more than two hours for the rescue workers to search before pulling up the car. Unfortunately, the man was drowned .	Rush into
123	123	Movement:Transport	99	救难人员分别坐在橡皮筏上以及潜入水中，在漆黑的夜色中试图搜 寻沉入水中的轿车，经过了两 个多小时终于发现。	潜入	0	1	Rescuers sat on rubber rafts and dived into the water. They tried to search for the sunken car in the dark night and finally found out after more than two hours.	sneak into
124	124	Movement:Transport	99	一名巴勒斯坦人在加沙地带靠近一个以色列军队哨所的地方发动自 杀性爆炸攻击，把自己炸死， 伊斯兰胜战者组织表示对这次自杀 性袭击事故负责，并警告说这不是最后的一次，这名巴勒斯坦 人 骑着自行车接近以色列哨所，在保护墙墙边引爆炸弹，一名以色列 军人受轻伤，以色列军方指 责巴勒斯坦当局纵容这次袭击，巴勒 斯坦一位安全官员驳斥这种指责，当天是伊斯兰圣战者组织 领导 人西卡奇遇刺5周年，人们普遍都指责那次行刺是以色列部队干的 ，既将担任黎巴嫩总理的哈 利里组成了有将近30名成员的内阁 ，其中穆斯林和基督教徒人数相当，哈利里和拉夫德总统以及 贝 里议长开会之后宣布了这个名单，新内阁几乎比原政府的内阁大了 1倍，只包括了4名原来的内 阁成员，一些黎巴嫩政界人士指责 叙利亚干预部长的选举，给这个过程蒙上了阴影。	接近	12	13	A Palestinian launches a suicide bomber near an Israeli army post in the Gaza Strip, killing himself. The Islamic Victorious Organization has claimed responsibility for the suicide attack and warned that this was not the last time. A Palestinian rides a bicycle near an Israeli post, detonates a bomb near a protective wall, an Israeli soldier is slightly injured, the Israeli military accuses the Palestinian authorities of condoning the attack, and a Palestinian security official refutes such accusations. The 5th anniversary of the assassination of the leader of the jihadist Sikazi. It is widely accused that the assassination was carried out by Israeli forces. Hariri, who will serve as prime minister of Lebanon, formed a cabinet of nearly 30 members, including Muslims and Christians. Quite, the list was announced after a meeting between President Hariri and President Love and Speaker Bailey. The new cabinet is almost twice the size of the original government&#39;s cabinet, including only four former cabinet members. Some Lebanese politicians have accused Syria of intervening. The election of ministers cast a shadow over this process.	Approach
125	125	Movement:Transport	99	中国第17次赴南极考察的37名乘员6名人文学者于12月7号 上午起程，他们将途经巴黎、智利等地 ，预计在本月12号抵达 南极，请看记者在首都机场所作的报道。	途经	3	4	The 37 crew members of the 17th China expedition to Antarctica and 6 humaneists set off on the morning of December 7. They will pass through Paris, Chile and other places. They are expected to arrive in Antarctica on the 12th of this month. .	via
126	126	Movement:Transport	99	中国第17次赴南极考察的37名乘员6名人文学者于12月7号 上午起程，他们将途经巴黎、智利等地 ，预计在本月12号抵达 南极，请看记者在首都机场所作的报道。	起程	1	2	The 37 crew members of the 17th China expedition to Antarctica and 6 humaneists set off on the morning of December 7. They will pass through Paris, Chile and other places. They are expected to arrive in Antarctica on the 12th of this month. .	leave
127	127	Movement:Transport	99	中国第17次赴南极考察的37名乘员6名人文学者于12月7号 上午起程，他们将途经巴黎、智利等地 ，预计在本月12号抵达 南极，请看记者在首都机场所作的报道。	赴	0	1	The 37 crew members of the 17th China expedition to Antarctica and 6 humaneists set off on the morning of December 7. They will pass through Paris, Chile and other places. They are expected to arrive in Antarctica on the 12th of this month. .	go
128	128	Movement:Transport	99	中国第17次赴南极考察的37名乘员6名人文学者于12月7号 上午起程，他们将途经巴黎、智利等地 ，预计在本月12号抵达 南极，请看记者在首都机场所作的报道。	抵达	7	8	The 37 crew members of the 17th China expedition to Antarctica and 6 humaneists set off on the morning of December 7. They will pass through Paris, Chile and other places. They are expected to arrive in Antarctica on the 12th of this month. .	arrival
129	129	Movement:Transport	99	“可能到南极我拍的和我想的可能更多的跟水有关，因为地球上水 资源正在枯竭，据说，80%到91% 的淡水在南极，所以我想 到那儿我去看南极的水。”	到	1	2	&quot;Maybe I shot in Antarctica and I think it might be more related to water, because the water resources on the earth are drying up. It is said that 80% to 91% of the fresh water is in Antarctica, so I thought that I would go to see the water in Antarctica. &quot;	To
130	130	Movement:Transport	99	“可能到南极我拍的和我想的可能更多的跟水有关，因为地球上水 资源正在枯竭，据说，80%到91% 的淡水在南极，所以我想 到那儿我去看南极的水。”	到	15	16	&quot;Maybe I shot in Antarctica and I think it might be more related to water, because the water resources on the earth are drying up. It is said that 80% to 91% of the fresh water is in Antarctica, so I thought that I would go to see the water in Antarctica. &quot;	To
131	131	Movement:Transport	99	新华社天津１２月３１日电（记者满学杰）在２０世纪的最后一天 ，百岁老人郑保举来到了他魂牵梦绕的故乡－－大沽口。	来到	6	7	Xinhua News Agency, Tianjin, December 31 (Reporter Man Xuejie) On the last day of the 20th century, the 100-year-old man Zheng Baoju came to his hometown of dreams-Dagukou.	come
132	132	Movement:Transport	99	１９９１年海湾战争结束后，根据联合国安理会６８９号决议，联 合国向在科、伊边境划定的非军事区派出了联合国军事观察团，其 任务是监督该地区领空的一切军事活动，确保科、伊边境的安全与 稳定。	派出	7	8	After the Gulf War in 1991, in accordance with UN Security Council Resolution 689, the United Nations sent a United Nations military observation mission to the demilitarized zone demarcated on the border between Kazakhstan and Iran. Its mission is to monitor all military activities in the airspace in the region and ensure Security and stability at the border.	send
133	133	Movement:Transport	99	一从非典疫区返宁的普通市民要求隔离检查竟然无望	返	0	1	An ordinary citizen returning to Ningxia from an atypical pneumonia area asked for quarantine inspection	return
134	134	Movement:Transport	99	新华社哈瓦那１２月１４日电（记者郑建东）阿根廷前著名球星马 拉多纳日前重返古巴，除了几乎与他形影不离的经纪人科波拉以外 ，还有一尊他１１日获得的国际足联颁发的“本世纪最佳足球运动 员”的奖杯。	重返	5	6	Xinhua News Agency, Havana, December 14th (Reporter Zheng Jiandong) Former Argentine star Maradona returned to Cuba a few days ago. In addition to his almost inseparable agent Coppola, there is also a respected FIFA award that he received on the 11th. Of the &quot;Best Football Player of the Century&quot;.	return
135	135	Movement:Transport	99	妹妹家刚刚搞了装潢，邀请弟兄姐妹携儿带女前去参观，随便也算 是年前聚一聚，热闹一把，时间定在上周日中午。	前去	2	3	My sister&#39;s home has just been decorated, and I invite my brethren and sisters to bring their daughters and daughters to visit them. They can be considered as a year-end gathering and lively. The time is set to be at noon last Sunday.	Go forward
136	136	Movement:Transport	99	新华社莫斯科１１月１日电（记者秦德岐）莫斯科时间１日７时零 ４分，俄罗斯货运飞船“进步Ｍ１－３”号脱离国际空间站，以便 腾出对接口，供３１日升空的载有国际空间站首批“居民”的飞船 对接使用。	脱离	13	14	Xinhua News Agency, Moscow, November 1st (Reporter Qin Deqi) At 7:04 on the Moscow time, the Russian cargo spacecraft &quot;Progress M1-3&quot; left the International Space Station in order to free up the interface for launch on 31st. The first batch of &quot;resident&quot; spacecraft docking on the International Space Station.	Break away
137	137	Movement:Transport	99	新华社哈尔滨１０月８日电（何文泽、梁维德）铁路警察杜海平在 下班回家途中，面对正在持刀逃跑的歹徒，他挺身而出，持手空拳 与歹徒进行殊死搏斗，英勇牺牲，为及时擒获歹徒赢得了战机，谱 写了一曲英雄主义凯歌。	回	7	8	Xinhua News Agency, Harbin, October 8 (He Wenze, Liang Weide) On the way home from work, railway police officer Du Haiping faced the gangster who was fleeing with a knife. He stepped forward and held an air fist to fight the gangster with revenge. The timely capture of the gangsters won the fighter plane and composed a heroic triumph.	Times
138	138	Movement:Transport	99	前几天在加拿大发生车祸的台湾旅行团所有的死伤团员的家属都已 经抵达到了温哥华，同时第一 批伤势比较轻的团员也已经搭机在 返国的途中。	抵达	1	2	The families of all the wounded and injured members of the Taiwanese tour group who had a car accident in Canada a few days ago have arrived in Vancouver, and the first group of relatively less injured members have also taken the flight on their way home.	arrival
139	139	Movement:Transport	99	前几天在加拿大发生车祸的台湾旅行团所有的死伤团员的家属都已 经抵达到了温哥华，同时第一 批伤势比较轻的团员也已经搭机在 返国的途中。	返	5	6	The families of all the wounded and injured members of the Taiwanese tour group who had a car accident in Canada a few days ago have arrived in Vancouver, and the first group of relatively less injured members have also taken the flight on their way home.	return
140	140	Movement:Transport	99	另外第二批团员的家属今天也抵达了温哥华，孙女被安置在市立医 院的张湘婷也是其中的一位。	抵达	0	1	In addition, the family members of the second group of members also arrived in Vancouver today.	arrival
141	141	Movement:Transport	99	国外众多飞机制造商也不远万里来到珠海，向中国航空界推介他们 生产的支线客机：波音公司推出了新一代波音７３７－７００中短 程商务喷气飞机，空中客车、庞巴迪以及俄罗斯、乌克兰等国的航 空制造企业也纷纷展示他们最新研制的支线飞机，借珠海国际航展 这个“窗口”挺进中国支线飞机市场。	来到	0	1	Many foreign aircraft manufacturers have come to Zhuhai not far away to introduce their regional airliners to the Chinese aviation industry: Boeing has launched a new generation of Boeing 7377-700 mid- and short-range business jets, Airbus, Bombardier, and Russia, Ukraine and other countries Aviation manufacturers have also displayed their latest regional aircraft development, and have used the &quot;window&quot; of the Zhuhai International Air Show to enter the Chinese regional aircraft market.	come
142	142	Movement:Transport	99	新华社新加坡１１月２３日电应新加坡总理吴作栋的邀请，中国国 务院总理朱（金字旁容）基２３日下午乘专机抵达新加坡，出席将 在这里举行的第四次东盟与中日韩领导人会晤和东盟与中国领导人 会晤。	抵达	7	8	Xinhua News Agency, Singapore, November 23rd. At the invitation of Singapore&#39;s Prime Minister Goh Chok Tong, Premier Zhu Rongji of the State Council of China arrived in Singapore by special plane on the afternoon of the 23rd to attend the fourth ASEAN, China, Japan and South Korea leaders&#39; meeting to be held here. Meeting with ASEAN and Chinese leaders.	arrival
143	143	Movement:Transport	99	新华社北京１１月７日电中央军委委员、中国人民解放军总政治部 主任于永波一行结束了对美国的正式访问，今天返回北京。	访问	3	4	Xinhua News Agency, Beijing, November 7th. Yu Yongbo, member of the Central Military Commission and director of the General Political Department of the Chinese People&#39;s Liberation Army, and his party ended their official visit to the United States and returned to Beijing today.	access
144	144	Movement:Transport	99	新华社北京１１月７日电中央军委委员、中国人民解放军总政治部 主任于永波一行结束了对美国的正式访问，今天返回北京。	返回	5	6	Xinhua News Agency, Beijing, November 7th. Yu Yongbo, member of the Central Military Commission and director of the General Political Department of the Chinese People&#39;s Liberation Army, and his party ended their official visit to the United States and returned to Beijing today.	return
145	145	Movement:Transport	99	随同于永波访问的广州军区政委刘书田、兰州军区副司令员兼兰州 军区空军司令员马晓天、南京军区政治部主任刘永治、总政治部秘 书长程宝山、国防部外事办公室副主任张邦栋等同机抵京。	访问	0	1	Liu Shutian, political commissar of the Guangzhou Military Region, accompanied by Yu Yongbo, Ma Xiaotian, deputy commander of the Lanzhou Military Region and air force commander of the Lanzhou Military Region, Liu Yongzhi, director of the Political Department of the Nanjing Military Region, Cheng Baoshan, secretary-general of the General Political Department, and Zhang Bangdong, deputy director of the Foreign Affairs Office of the Ministry of National Defense arrived at the same opportunity. Beijing.	access
146	146	Movement:Transport	99	随同于永波访问的广州军区政委刘书田、兰州军区副司令员兼兰州 军区空军司令员马晓天、南京军区政治部主任刘永治、总政治部秘 书长程宝山、国防部外事办公室副主任张邦栋等同机抵京。	抵	10	11	Liu Shutian, political commissar of the Guangzhou Military Region, accompanied by Yu Yongbo, Ma Xiaotian, deputy commander of the Lanzhou Military Region and air force commander of the Lanzhou Military Region, Liu Yongzhi, director of the Political Department of the Nanjing Military Region, Cheng Baoshan, secretary-general of the General Political Department, and Zhang Bangdong, deputy director of the Foreign Affairs Office of the Ministry of National Defense arrived at the same opportunity. Beijing.	Arrive
147	147	Movement:Transport	99	到机场迎接的有总政治部副主任唐天标，国防部外事办公室副主任 李东辉和总政治部副秘书长张铁健等。	到	0	1	Meet at the airport were Tang Tianbiao, deputy director of the General Political Department, Li Donghui, deputy director of the Foreign Affairs Office of the Ministry of National Defense, and Zhang Tiejian, deputy secretary general of the General Political Department.	To
148	148	Movement:Transport	99	刮刮乐诈财集团逃避查缉又有新的手法，台中县松原地区的邮筒最 近一个礼拜就被投递了有4万多 封刮刮乐的诈财信函，警方人员 初步研判可能是集团分子担心到邮局交递大批的邮件可能会被录  下容貌，因此特意投入郊区的邮筒来躲避警方的查缉。	到	7	8	The Scrabble Group has a new method to evade detection. Postboxes in the Songyuan District of Taichung County have been delivered more than 40,000 fraudulent letters in the past week. Police officers have initially determined that the group members may be worried about delivering large quantities to the post office. E-mails may be recorded for their features, so they deliberately dropped into post boxes in the suburbs to avoid police investigations.	To
149	149	Movement:Transport	99	据了解，此案的被告人为今年２９岁的安徽省来京从事服装生意的 王祚聪，被害人则是被王祚聪认为与其夫胡孝胜有暧昧关系的２４ 岁的女同乡束志梅。	来	2	3	It is understood that the defendant in this case was Wang Jicong, a 29-year-old Anhui province who came to Beijing to engage in clothing business. The victim was a 24-year-old lesbian villager Shu Zhimei who was considered to have an ambiguous relationship with her husband Hu Xiaosheng.	Come
150	150	Movement:Transport	99	新华社安曼１２月２６日电（记者鲁绍明 王丙飞）约旦驻塞拉利 昂的最后一批维和部队官兵２５日夜乘飞机返回约旦首都安曼。	返回	6	7	Xinhua News Agency, Amman, December 26 (Reporter Lu Shaoming, Wang Bingfei) The last batch of Jordanian peacekeepers stationed in Sierra Leone flew back to the Jordanian capital Amman on the night of the 25th.	return
151	151	Movement:Transport	99	约旦今年向塞拉利昂派出了１８５０名官兵的维和部队。	派出	0	1	Jordan sent 1,850 peacekeeping troops to Sierra Leone this year.	send
152	152	Movement:Transport	99	新华社北京１０月３日电（记者任忆）今天，上百名环保志愿者来 到北京中山公园，在这里举办“我给你一个家”动物救助活动，以 此纪念即将到来的“世界动物日”。	"来
到"	6	8	Xinhua News Agency, Beijing, October 3 (Reporter Ren Yi) Today, hundreds of environmental protection volunteers came to Beijing Zhongshan Park to host an &quot;I Give You a Home&quot; animal rescue activity to commemorate the upcoming &quot;World Animal Day&quot; &quot;.	come
153	153	Movement:Transport	99	新华社北京１０月１２日电（记者谭国器）全国人大常委会委员长 李鹏今天在人民大会堂会见了由国际狮子会会长让·贝亚尔率领的 国际狮子会代表团及来京参加“世界视觉日”活动的９个国家和地 区的眼科专家。	来	8	9	Xinhua News Agency, Beijing, October 12 (Reporter Tan Guoqi) Li Peng, chairman of the Standing Committee of the National People&#39;s Congress, met today with a delegation from the International Lions Club led by President Jean Beyer of the International Lions Club and came to Beijing to participate in the &quot;World Ophthalmologists from 9 countries and regions with Vision Day.	Come
154	154	Movement:Transport	99	国际狮子会代表团是应中国残疾人联合会和卫生部的邀请于１０月 ９日抵京，出席在北京举办的国际狮子会２０００年“世界视觉日 ”活动的。	抵	1	2	The International Lions Club delegation arrived in Beijing on October 9 at the invitation of the China Disabled Persons&#39; Federation and the Ministry of Health to attend the International Lions Club World Vision Day 2000 event in Beijing.	Arrive
155	155	Movement:Transport	99	高雄县龙发塘一名精神病犯昨天深夜突然的自杀，龙发塘指出，这 名死者是去年4月因为自焚由家 人送到龙发塘接受治疗，没想到 确突然的自杀，家属也很无奈。	送到	6	7	A mental patient in Longfatang, Kaohsiung County suddenly committed suicide late last night. Longfatang pointed out that the deceased was sent to Longfatang for treatment by his family last April because of self-immolation. He did not expect that the suicide suddenly occurred, and his family members were helpless .	Deliver
156	156	Movement:Transport	99	第二天上班，老板让我去长途车站托运主板，比头一天轻多了，我 冒着酷暑干完了。	去	2	3	The next day I went to work. The boss asked me to check the motherboard at the long-distance station. It was much lighter than the previous day.	go with
157	157	Movement:Transport	99	第三天上班，老板还是让我去车站托运散件，和第二天差不多，我 冒着酷暑又干完了。	去	2	3	On the third day at work, the boss still asked me to check in the parts at the station, which was almost the same as the next day.	go with
158	158	Movement:Transport	99	新华社河内１２月２５日电（记者张加祥　侯鹤祥）越南国家主席 陈德良今天上午乘专机前往中国进行正式友好访问时在河内机场对 本社记者说，他应江泽民主席邀请进行的这次访问将是越中友好合 作关系发展进程中又一个重要里程碑。	访问	6	7	Xinhua News Agency, Hanoi, December 25 (Reporter Zhang Jiaxiang, Hou Hexiang) Vietnamese President Chen Deliang told a reporter at the Hanoi Airport during a formal friendly visit to China by special plane this morning that he was invited by President Jiang Zemin to visit Vietnam China Another important milestone in the development of friendly cooperative relations.	access
