	Unnamed: 0	Event_Type	Count	Sample_sentence	Trigger	Start	End	sentence_translation	trigger_translation
331	331	Personnel:Start-Position	12	自从１０月底埃里克森被确定为英格兰队的主教练后，拉齐奥队不 管在国内联赛中还是在冠军杯赛中的成绩都一路下滑，在过去８场 比赛中，他们输掉了５场。	确定	0	1	Since Eriksson was identified as England&#39;s head coach at the end of October, Lazio&#39;s performance has been declining in both the domestic league and the Champions League. In the past eight games, they have lost five.	determine
332	332	Contact:Phone-Write	10	郎平在获奖之后接受记者的电话采访时说，拿到这个最佳教练奖非 常高兴，但是今年联赛马上又要开始了，一些摩德纳队的老队员已 经被其它俱乐部挖走，因此今年的联赛任务更重。	电话	0	1	After receiving the award, Lang Ping said in a telephone interview with reporters that he was very happy to receive the best coach award, but this year the league is about to start again. Some old members of Modena have been dug out by other clubs, so this year ’s league tasks are even more important. weight.	phone
333	333	Contact:Phone-Write	10	在为中国残奥会代表团夺取了第一枚金牌后，徐红艳第一件事就是 把越洋电话打到了江苏老家，把喜悦与母亲分享。	电话	3	4	After winning the first gold medal for the delegation of the Chinese Paralympic Games, Xu Hongyan&#39;s first thing was to make an overseas call to her hometown in Jiangsu and share her joy with her mother.	phone
334	334	Contact:Phone-Write	10	新华社巴格达１２月２６日电（记者顾正龙）伊拉克外交部长萨哈 夫２６日致函联合国秘书长安南，要求对在伊拉克和科威特边境非 军事区上空从事敌对飞行活动的飞机进行调查，以维护该地区的和 平与稳定。	致函	5	6	Xinhua News Agency, Baghdad, December 26 (Reporter Gu Zhenglong) Iraqi Foreign Minister Sahaf sent a letter to UN Secretary-General Annan on the 26th requesting an investigation of aircraft engaged in hostile flight activities over the demilitarized zone on the border between Iraq and Kuwait in order to maintain the Regional peace and stability.	Write
335	335	Contact:Phone-Write	10	我多次电话联系都没人理我；	电话	0	1	I have been contacted many times and ignored me;	phone
336	336	Contact:Phone-Write	10	新华社联合国１０月１２日电（记者丁宝忠）巴勒斯坦常驻联合国 观察员基德瓦１２日致信安理会主席，要求召开安理会紧急会议， 制止以色列对巴勒斯坦人使用武力。	致信	5	6	Xinhua News Agency, United Nations, October 12th (Reporter Ding Baozhong) The Permanent Observer of Palestine to the United Nations, Kidwa, wrote to the President of the Security Council on the 12th, calling for an emergency meeting of the Security Council to stop Israel from using force against Palestinians.	Letter
337	337	Contact:Phone-Write	10	信中说，以色列１２日对加沙和约旦河西岸进行的袭击等于是对巴 勒斯坦人民“全面宣战”，这些军事行动在巴勒斯坦被占领土上造 成了大量人员伤亡和财产损失，违反了包括联合国决议在内的国际 准则，给地区冲突带来了新的不祥之兆。	信	0	1	The letter stated that the Israeli attacks on Gaza and the West Bank on the 12th were tantamount to a &quot;comprehensive declaration of war&quot; against the Palestinian people. These military actions caused a large number of casualties and property damage in the occupied Palestinian territory, in violation of the United Nations resolutions including The international norms within it have brought new ominous signs to regional conflicts.	letter
338	338	Contact:Phone-Write	10	新华社柏林１０月１７日电（记者王东）在悉尼残疾人奥运会开幕 之际，德国总理格哈德·施罗德今天致电德国残奥会代表团，祝他 们在本届残奥会上取得优异的成绩。	致电	9	10	Xinhua News Agency, Berlin, October 17th (Reporter Wang Dong) At the opening of the Sydney Paralympic Games, German Chancellor Gerhard Schroeder called the delegation of the German Paralympic Games today and wished them success Excellent results.	Call
339	339	Contact:Phone-Write	10	初中同学怀孕四个月了， 什么时候打个电话回去问候一下。	电话	2	3	Junior high school students are four months pregnant. When do you call back and say hello?	phone
340	340	Contact:Phone-Write	10	王新平基于礼貌还写了一封文情并茂的信向总统说明不去原因，在 野的三党一派立委手拉着手彼 此加油打气，心中共同的目标就是 倒戈和罢免。	信	0	1	Wang Xinping wrote a polite letter based on politeness to explain to the president why the opposition ’s three-party and one-member legislators joined hands to cheer each other up. The common goal in his heart was to sacrifice and dismiss.	letter
341	341	Contact:Phone-Write	10	新华社索非亚１０月２０日电（记者余志和）保加利亚国家警察局 局长瓦西列夫日前致信保政府有关部门，建议采取更严厉的法律和 行政措施，如修订《刑事诉讼法》和《劳教法》等，防治足球流氓 。	致信	5	6	Xinhua News Agency, Sofia, October 20th (Reporter Yu Zhihe) The Bulgarian National Police Director Vasilev wrote to the relevant government department to recommend more stringent legal and administrative measures, such as amendments to the Criminal Procedure Law and Reeducation through Labor. Law, etc., to prevent football hooligan.	Letter
342	342	Personnel:Elect	4	新华社贝尔格莱德１１月２３日电据南通社２３日报道，波黑塞尔 维亚民主党提名的候选人沙罗维奇在１１月１１日举行的大选中， 当选为波黑塞族共和国总统。	当选	5	6	Xinhua News Agency, Belgrade, November 23rd. According to Nantong News Agency on the 23rd, Bosnia-Herzegovina-nominated candidate Sharovich was elected as president of the Bosnian Serb Republic in the general election held on November 11.	Be elected
343	343	Personnel:Elect	4	沙罗维奇１９５９年出生，１９７９年毕业于萨拉热窝大学法律系 ，１９９６－１９９８年任波黑塞族共和国议会议员，１９９８年 底当选为波黑塞族共和国副总统。	当选	9	10	Born in 1959, Sarovich graduated from the Faculty of Law of the University of Sarajevo in 1979. He was a member of the Parliament of the Serbian Republic of Bosnia and Herzegovina from 1996 to 1998, and was elected Vice President of the Serbian Republic of Bosnia at the end of 1998.	Be elected
344	344	Personnel:Elect	4	新华社华盛顿１２月２０日电（记者胡晓明　汤水富）美国当选总 统乔治·沃克·布什２０日宣布了美国下届政府财政、商务、农业 以及住房和城市发展部部长提名。	当选	5	6	Xinhua News Agency, Washington, December 20th (Reporter Hu Xiaoming and Tang Shuifu) The United States-elected President George Walker Bush announced on the 20th the nomination of the Secretary of the Treasury, Commerce, Agriculture, and Housing and Urban Development of the next US government.	Be elected
345	345	Personnel:Elect	4	结束了， 如很多人所料， 也如很多人所担忧的， 布什连任了 。	连任	6	7	It&#39;s over. As many expected, and as many worried, Bush was re-elected.	Re-election
346	346	Personnel:Nominate	8	新华社贝尔格莱德１１月２３日电据南通社２３日报道，波黑塞尔 维亚民主党提名的候选人沙罗维奇在１１月１１日举行的大选中， 当选为波黑塞族共和国总统。	提名	3	4	Xinhua News Agency, Belgrade, November 23rd. According to Nantong News Agency on the 23rd, Bosnia-Herzegovina-nominated candidate Sharovich was elected as president of the Bosnian Serb Republic in the general election held on November 11.	Nominate
347	347	Personnel:Nominate	8	“为了不让我们的政务因为阁魁的更换有了空穿期，影响整个政务 的推动，所以这个人选的任命 我们完全支持总统的看法。”	任命	6	7	&quot;In order to prevent our government affairs from having a run-through period due to the change of the cabinet and affecting the promotion of the entire government affairs, the appointment of this candidate fully supports the president&#39;s view.&quot;	appointment
348	348	Personnel:Nominate	8	新华社华盛顿１２月１７日电（记者胡晓明　汤水富）美国当选总 统、得克萨斯州州长布什１７日宣布了几项重要提名，其首席对外 政策顾问康多莉扎·赖斯为总统国家安全事务助理，得州最高法院 法官阿尔韦托·冈萨雷斯为白宫首席律师，其发言人卡伦·休斯为 总统顾问。	提名	8	9	Xinhua News Agency, Washington, December 17 (Reporter Hu Xiaoming, Tang Shuifu) The United States-elected President and Governor of Texas Bush announced several important nominations on the 17th. Its chief foreign policy adviser, Condoleezza Rice, is the president ’s assistant to national security affairs. Texas Supreme Court Judge Alberto Gonzalez is the White House Chief Counsel and its spokesperson, Karen Hughes, is an adviser to the president.	Nominate
349	349	Personnel:Nominate	8	新华社华盛顿１２月１７日电（记者胡晓明　汤水富）美国当选总 统、得克萨斯州州长布什１７日宣布了几项重要提名，其首席对外 政策顾问康多莉扎·赖斯为总统国家安全事务助理，得州最高法院 法官阿尔韦托·冈萨雷斯为白宫首席律师，其发言人卡伦·休斯为 总统顾问。	为	13	14	Xinhua News Agency, Washington, December 17 (Reporter Hu Xiaoming, Tang Shuifu) The United States-elected President and Governor of Texas Bush announced several important nominations on the 17th. Its chief foreign policy adviser, Condoleezza Rice, is the president ’s assistant to national security affairs. Texas Supreme Court Judge Alberto Gonzalez is the White House Chief Counsel and its spokesperson, Karen Hughes, is an adviser to the president.	for
350	350	Personnel:Nominate	8	新华社华盛顿１２月１７日电（记者胡晓明　汤水富）美国当选总 统、得克萨斯州州长布什１７日宣布了几项重要提名，其首席对外 政策顾问康多莉扎·赖斯为总统国家安全事务助理，得州最高法院 法官阿尔韦托·冈萨雷斯为白宫首席律师，其发言人卡伦·休斯为 总统顾问。	为	18	19	Xinhua News Agency, Washington, December 17 (Reporter Hu Xiaoming, Tang Shuifu) The United States-elected President and Governor of Texas Bush announced several important nominations on the 17th. Its chief foreign policy adviser, Condoleezza Rice, is the president ’s assistant to national security affairs. Texas Supreme Court Judge Alberto Gonzalez is the White House Chief Counsel and its spokesperson, Karen Hughes, is an adviser to the president.	for
351	351	Personnel:Nominate	8	新华社华盛顿１２月１７日电（记者胡晓明　汤水富）美国当选总 统、得克萨斯州州长布什１７日宣布了几项重要提名，其首席对外 政策顾问康多莉扎·赖斯为总统国家安全事务助理，得州最高法院 法官阿尔韦托·冈萨雷斯为白宫首席律师，其发言人卡伦·休斯为 总统顾问。	为	22	23	Xinhua News Agency, Washington, December 17 (Reporter Hu Xiaoming, Tang Shuifu) The United States-elected President and Governor of Texas Bush announced several important nominations on the 17th. Its chief foreign policy adviser, Condoleezza Rice, is the president ’s assistant to national security affairs. Texas Supreme Court Judge Alberto Gonzalez is the White House Chief Counsel and its spokesperson, Karen Hughes, is an adviser to the president.	for
352	352	Personnel:Nominate	8	新华社华盛顿１２月２０日电（记者胡晓明　汤水富）美国当选总 统乔治·沃克·布什２０日宣布了美国下届政府财政、商务、农业 以及住房和城市发展部部长提名。	提名	15	16	Xinhua News Agency, Washington, December 20th (Reporter Hu Xiaoming and Tang Shuifu) The United States-elected President George Walker Bush announced on the 20th the nomination of the Secretary of the Treasury, Commerce, Agriculture, and Housing and Urban Development of the next US government.	Nominate
353	353	Personnel:Nominate	8	拉胡德当天向所有１２８名议员征询意见，其中１０６名议员提名 哈里里为新政府总理。	提名	2	3	Lahoud sought advice from all 128 lawmakers on the day, of which 106 nominated Hariri as the new government&#39;s prime minister.	Nominate
354	354	Life:Be-Born	4	沙罗维奇１９５９年出生，１９７９年毕业于萨拉热窝大学法律系 ，１９９６－１９９８年任波黑塞族共和国议会议员，１９９８年 底当选为波黑塞族共和国副总统。	出生	0	1	Born in 1959, Sarovich graduated from the Faculty of Law of the University of Sarajevo in 1979. He was a member of the Parliament of the Serbian Republic of Bosnia and Herzegovina from 1996 to 1998, and was elected Vice President of the Serbian Republic of Bosnia at the end of 1998.	Born
355	355	Life:Be-Born	4	出生于甘肃兰州的张学忠１９６０年１２月加入中国共产党，１９ ６１年７月参加工作，大学专科学历；在家乡先后任小学教员，甘 肃省人防办秘书处秘书，甘肃省委办公厅秘书处秘书，武威县法放 公社党委书记，榆中县委书记，兰州市委副书记，陇南地委书记； １９８９年后任甘肃省副省长；１９９０年后任中共西藏自治区委 副书记；１９９４年后任人事部副部长、中共人事部党组成员、党 组副书记；１９９９年６月至１２月兼任中共中央大型企业工委委 员；２０００年１１月任中共人事部党组书记。	出生	0	1	Born in Lanzhou, Gansu, Zhang Xuezhong joined the Communist Party of China in December 1960, joined the work in July 1961, and has a college degree; he has been a primary school teacher in his hometown, secretary of the Gansu Provincial Civil Defense Office Secretariat, and secretary of the Secretariat of the Gansu Provincial Party Committee Office. Secretary of the Party Committee of the French Communities of Wuwei County, Secretary of the Yuzhong County Party Committee, Deputy Secretary of the Lanzhou Municipal Party Committee, Secretary of the Longnan Prefectural Party Committee; Deputy Governor of Gansu Province after 1989; Deputy Secretary of the Tibet Autonomous Region Party Committee of the CPC since 1990; Member of the CPC Leading Group and Deputy Secretary of the CPC Leading Group; concurrently served as a member of the CPC Central Committee&#39;s Large Enterprise Working Committee from June to December 1999;	Born
356	356	Life:Be-Born	4	我算是土生土长的南京人，虽然父辈只是随部队南下才到南京，但 我可是在南京出生，在南京长大的，除了在上海当兵的十年。	出生	5	6	I am a native of Nanjing. Although my parents only came to Nanjing with the army, I was born in Nanjing and grew up in Nanjing, except for ten years in Shanghai.	Born
357	357	Life:Be-Born	4	我算是土生土长的南京人，虽然父辈只是随部队南下才到南京，但 我可是在南京出生，在南京长大的，除了在上海当兵的十年。	出生	5	6	I am a native of Nanjing. Although my parents only came to Nanjing with the army, I was born in Nanjing and grew up in Nanjing, except for ten years in Shanghai.	Born
358	358	Justice:Arrest-Jail	19	在今天的“现身说法”警示教育会上，原陕西省人民银行营业部柜 台负责人淡东晖等７名因贪污、受贿、挪用公款等罪被判刑的服刑 人员，分别现场讲述了各自由一名党员、干部、企业管理人员、军 人、人民警察变成罪人，走上犯罪道路的沉痛教训。	服刑	11	12	At today&#39;s &quot;Appearance Statement&quot; warning education meeting, Dan Donghui, former head of the sales department of Shaanxi Provincial People&#39;s Bank, and seven other prisoners sentenced for corruption, bribery, embezzlement of public funds, etc., each told on the spot Party members, cadres, enterprise managers, soldiers, and people&#39;s police have become sinners, and they have learned the painful lessons of crime.	Serve a sentence
359	359	Justice:Arrest-Jail	19	新华社哈尔滨１０月８日电（何文泽、梁维德）铁路警察杜海平在 下班回家途中，面对正在持刀逃跑的歹徒，他挺身而出，持手空拳 与歹徒进行殊死搏斗，英勇牺牲，为及时擒获歹徒赢得了战机，谱 写了一曲英雄主义凯歌。	擒获	18	19	Xinhua News Agency, Harbin, October 8 (He Wenze, Liang Weide) On the way home from work, railway police officer Du Haiping faced the gangster who was fleeing with a knife. He stepped forward and held an air fist to fight the gangster with revenge. The timely capture of the gangsters won the fighter plane and composed a heroic triumph.	Capture
360	360	Justice:Arrest-Jail	19	佘国信，５７岁，原系广西壮族自治区人民政府主席助理，广西壮 族自治区财政厅厅长、党组书记，因涉嫌受贿于２０００年１月１ ７日被公安机关逮捕。	逮捕	12	13	Wu Guoxin, 57, was formerly assistant to the chairman of the People ’s Government of Guangxi Zhuang Autonomous Region, director of the Finance Department of the Guangxi Zhuang Autonomous Region, and secretary of the party group. He was arrested on January 17, 2000 by the public security organs for allegedly taking a bribe.	Arrest
361	361	Justice:Arrest-Jail	19	据这位首席检察官透露，被捕的贩毒分子是科隆人，今年３４岁， 他因为非法经营大量可卡因而被逮捕。	捕	2	3	According to the chief prosecutor, the arrested drug trafficker was a Cologne. At the age of 34, he was arrested for illegally operating a large number of cocaine.	catch
362	362	Justice:Arrest-Jail	19	据这位首席检察官透露，被捕的贩毒分子是科隆人，今年３４岁， 他因为非法经营大量可卡因而被逮捕。	逮捕	6	7	According to the chief prosecutor, the arrested drug trafficker was a Cologne. At the age of 34, he was arrested for illegally operating a large number of cocaine.	Arrest
363	363	Justice:Arrest-Jail	19	新华社金边１１月２４日电（记者晏明　李超碧）柬埔寨首都金边 市政府２４日上午发表声明说，柬政府武装力量已经逮捕了参与２ ４日凌晨在金边市武装袭击军警的恐怖分子２１人，击毙７人。	逮捕	8	9	Xinhua News Agency, Phnom Penh, November 24 (Reporter Yan Ming Li Chaobi) The Cambodian capital ’s Phnom Penh city government issued a statement on the morning of the 24th that the Cambodian government ’s armed forces have arrested 21 terrorists involved in the armed attack on the police in Phnom Penh in the early hours of the 24th. , Killed 7 people.	Arrest
364	364	Justice:Arrest-Jail	19	继海军前舰管室主任雷学明被释放之后呢，涉及拉瓦耶级军舰弊购 案的前海军少将王庭深以及其 他两名军官康士成，还有程志波也 在今天以羁押期限已满，开庭审理之后当庭释放。	羁押	7	8	Following the release of Lei Xueming, the former director of the Naval Ship Management Office, the former Navy Major-General Wang Tingshen and two other officers, Kang Shicheng, and Cheng Zhibo, who have been involved in the purchase of the Lavaye-class warship, have expired today. He was released in court after the trial.	Detention
365	365	Justice:Arrest-Jail	19	新华社重庆１０月２日电（记者代群）经重庆市人民检察院第一分 院批准，重庆市公安局日前对在重庆抓获的涉嫌渝湘鄂系列持枪杀 人抢劫案的张君及其同伙共６人宣布逮捕。	逮捕	8	9	Xinhua News Agency, Chongqing, October 2 (Reporter Dai Qun) With the approval of the First Branch of the Chongqing People&#39;s Procuratorate, the Chongqing Municipal Public Security Bureau recently shared Zhang Jun and his accomplices who were arrested in Chongqing for a series of gun robbery in Chongqing, Hubei and Hunan Six people announced their arrest.	Arrest
366	366	Justice:Arrest-Jail	19	新华社重庆１０月２日电（记者代群）经重庆市人民检察院第一分 院批准，重庆市公安局日前对在重庆抓获的涉嫌渝湘鄂系列持枪杀 人抢劫案的张君及其同伙共６人宣布逮捕。	抓获	7	8	Xinhua News Agency, Chongqing, October 2 (Reporter Dai Qun) With the approval of the First Branch of the Chongqing People&#39;s Procuratorate, the Chongqing Municipal Public Security Bureau recently shared Zhang Jun and his accomplices who were arrested in Chongqing for a series of gun robbery in Chongqing, Hubei and Hunan Six people announced their arrest.	Capture
367	367	Justice:Arrest-Jail	19	新华社成都１２月２４日电（记者任硌）今年下半年以来，四川省 达州市公安机关集中开展的“打黑除恶”专项斗争，一举摧毁带有 黑社会性质的流氓恶势力团伙５个，抓获涉黑违法犯罪嫌疑人１５ ６人。	抓获	16	17	Xinhua News Agency, Chengdu, December 24 (Reporter Ren Ye) Since the second half of this year, the public security organs of Dazhou City, Sichuan Province have carried out a special campaign of &quot;anti-crime and anti-evil&quot;, destroying five gangsters and evil gangs with a triad nature and arrested There are 156 criminal suspects involved in black crimes.	Capture
368	368	Justice:Arrest-Jail	19	新华社北京１１月２４日电（段颖　孙玉波）记者今天从北京海关 获悉，１１月２０日上午１１时１０分，随着两名涉嫌通过邮政快 递渠道走私毒品的台湾籍犯罪嫌疑人－－简志仲和李金正在北京朝 阳小区的家中被抓获，一起邮寄毒品案已被北京海关破获。	抓获	15	16	Xinhua News Agency, Beijing, November 24 (Duan Ying and Sun Yubo) A reporter learned from Beijing Customs today that at 11.10 am on November 20, two Taiwanese criminals suspected of smuggling drugs through postal express delivery channels-Jian Zhizhong He and Li Jin were arrested at his home in Chaoyang District, Beijing, and a drug mailing case was cracked by Beijing Customs.	Capture
369	369	Justice:Arrest-Jail	19	金龙局渔船星河发36号船上的大陆渔工前天挟持了船长和轮机长 ，企图把船开到大陆，海事处紧 急的派出了船舰在海峡中间附近 拦截到这艘渔船，并且将8名的大陆渔工带回来统统回押。	回押	8	9	The mainland fisherman on board the fishing boat Xinghe Fa 36 of the Golden Dragon Bureau held the captain and the chief engineer the day before yesterday in an attempt to sail the ship to the mainland. Mainland fishermen brought back all to be taken back.	Charge back
370	370	Justice:Arrest-Jail	19	据保国家电视台２０日晚报道，索非亚警察已拘捕了４名投掷自制 手雷的嫌疑犯。	拘捕	2	3	According to a report on the evening of the 20th, national television reported that Sofia police had arrested four suspects who threw homemade grenades.	arrest
371	371	Justice:Arrest-Jail	19	江苏省连云港市公安边防支队在１９９９年底进行的反偷渡专项行 动中，一举摧毁了这个以大“蛇头”翁金顺为首的特大跨省组织偷 渡团伙，抓获涉案人员４０多人。	抓获	10	11	In the special anti-smuggling operation carried out by the Lianyungang City Border Guard Detachment of Jiangsu Province at the end of 1999, it destroyed the extra large inter-provincial smuggling gang led by the big &quot;snake head&quot; Weng Jinshun and arrested more than 40 people involved in the case.	Capture
372	372	Justice:Arrest-Jail	19	新华社马德里１１月２４日电（记者夏顺英）西班牙政府２４日批 准了西班牙和意大利关于追捕恐怖主义分子和黑手党分子等重大罪 犯的条约，以替换现有的引渡协定。	追捕	5	6	Xinhua News Agency, Madrid, November 24 (Reporter Xia Shunying) The Spanish government ratified a treaty between Spain and Italy on the hunt for major criminals such as terrorists and mafia elements to replace the existing extradition agreement.	Hunt
373	373	Justice:Arrest-Jail	19	新华社昆明１２月２４日电（李春　杨金高）云南临沧公安边防支 队河外边防工作站日前破获一起特大跨国贩运冰毒案，当场抓获贩 毒嫌疑人１名，缴获冰毒３０公斤。	抓获	8	9	Xinhua News Agency, Kunming, December 24th (Li Chun Yang Jingao) The Hewai Border Guard Station of the Lincang Public Security Border Detachment of Yunnan Province has recently cracked a catastrophic case of transnational trafficking in methamphetamine. One suspect was arrested on the spot and 30 kilograms of methamphetamine were seized.	Capture
374	374	Justice:Arrest-Jail	19	巴警方目前尚未抓获任何嫌疑犯，也没有任何个人或组织宣布对爆 炸事件负责。	抓获	0	1	The Pakistani police have not yet arrested any suspects, and no individual or organization has declared responsibility for the explosion.	Capture
375	375	Justice:Arrest-Jail	19	关押周正毅的上海提篮桥监狱内部人士也否定了这一传言，称其未 听说周正毅已经获得保外就医的批准，至少相关的文件在其职能内 并未看见。	关押	0	1	Insiders of Shanghai Tilanqiao Prison, who held Zhou Zhengyi, also denied the rumor, saying that he had not heard that Zhou Zhengyi had been approved for medical treatment outside the bail, at least the relevant documents were not seen in his function.	Detain
