	Unnamed: 0	Event_Type	Count	Sample_sentence	Trigger	Start	End	sentence_translation	trigger_translation
257	257	Justice:Sentence	20	新华社南宁１１月３日电（记者程义峰　刘水玉）原广西壮族自治 区财政厅厅长佘国信受贿一案今日作出一审判决，南宁市中级人民 法院依法判处被告人佘国信无期徒刑，剥夺政治权利终身，并处没 收其个人全部所有财产。	判决	6	7	Xinhua News Agency, Nanning, November 3 (Reporter Cheng Yifeng, Liu Shuiyu) The former Guangxi Zhuang Autonomous Region Minister of Finance Xi Guoxin took a bribery decision today. The Nanning Intermediate People&#39;s Court sentenced the defendant Ji Guoxin to life imprisonment and deprived him of political rights for life. And confiscate all his personal property.	judgment
258	258	Justice:Sentence	20	新华社南宁１１月３日电（记者程义峰　刘水玉）原广西壮族自治 区财政厅厅长佘国信受贿一案今日作出一审判决，南宁市中级人民 法院依法判处被告人佘国信无期徒刑，剥夺政治权利终身，并处没 收其个人全部所有财产。	判处	9	10	Xinhua News Agency, Nanning, November 3 (Reporter Cheng Yifeng, Liu Shuiyu) The former Guangxi Zhuang Autonomous Region Minister of Finance Xi Guoxin took a bribery decision today. The Nanning Intermediate People&#39;s Court sentenced the defendant Ji Guoxin to life imprisonment and deprived him of political rights for life. And confiscate all his personal property.	Sentence
259	259	Justice:Sentence	20	据悉，法院将择日对此案进行宣判。	宣判	2	3	It is reported that the court will decide on this case on another day.	Sentence
260	260	Justice:Sentence	20	新华社成都１２月２１日电（记者任硌）在四川引起强烈反响的资 阳市“９·４”带黑社会性质的特大持枪杀人案日前经资阳地区中 级人民法院一审审理终结，余茂学、黄胜、廖忠福、李月刚等４名 被告被依法判处死刑，替余茂学通风报信的莫维刚被判处有期徒刑 两年。	判处	23	24	Xinhua News Agency, Chengdu, December 21st (Reporter Ren Ye) The 9.4-year-old gangster-like homicide in Ziyang City, which caused strong repercussions in Sichuan, was recently concluded by the first trial of the Intermediate People&#39;s Court in Ziyang, Yu Maoxue, Huang Sheng Four defendants, Liao Zhongfu and Li Yuegang were sentenced to death according to law, and Mo Weigang, who reported to Yu Maoxue, was sentenced to two years in prison.	Sentence
261	261	Justice:Sentence	20	新华社吉隆坡１２月７日电（记者吴定保）马来西亚吉隆坡高等法 院７日宣布，判处６名“奥马乌纳”邪教组织成员每人１０年徒刑 。	判处	7	8	Xinhua News Agency, Kuala Lumpur, December 7 (Reporter Wu Dingbao) The Kuala Lumpur High Court of Malaysia announced on the 7th that it sentenced six members of the &quot;Omauna&quot; cult to 10 years in prison each.	Sentence
262	262	Justice:Sentence	20	安徽省合肥市中级人民法院昨天对原阜阳市市长肖作新受贿、巨额 财产来源不明，周纪美受贿、 贪污、非法倒卖土地使用权、巨额 财产来源不明一案，作出一审判决：肖作新、周纪美夫妇分别 被 判处无期徒刑和死刑，缓期二年执行，并处没收个人全部财产。	判处	20	21	The Intermediate People&#39;s Court of Hefei City, Anhui Province yesterday made a new bribery to the former Mayor of Fuyang City, Xiao, and the source of the huge amount of property was unknown. Sentenced to life imprisonment and death, suspended for two years, and confiscated all personal property.	Sentence
263	263	Justice:Sentence	20	新华社华沙１２月８日电（记者王京臣）波兰普沃茨克市地方法院 ８日对一个名叫“撒旦”的邪教组织的３名成员进行了刑事判决。	判决	9	10	Xinhua News Agency, Warsaw, December 8 (Reporter Wang Jingchen) The local court of the Płock City, Poland, sentenced three members of a cult named &quot;Satan&quot; on the 8th.	judgment
264	264	Justice:Sentence	20	大“蛇头”翁金顺被判无期徒刑	判	4	5	Big &quot;snake head&quot; Weng Jinshun sentenced to life imprisonment	Sentence
265	265	Justice:Sentence	20	大“蛇头”翁金顺被判无期徒刑	判	4	5	Big &quot;snake head&quot; Weng Jinshun sentenced to life imprisonment	Sentence
266	266	Justice:Sentence	20	新华社南京１１月２４日电（邹煊　张凯）曾先后１４次组织偷渡 活动的“蛇头”翁金顺今天被江苏省连云港市中级人民法院一审判 处无期徒刑，另外２名“蛇头”崔顺军、林正清分别被判处有期徒 刑１２年，“蛇头”王月东被判处有期徒刑８年。	"判
处"	10	12	Xinhua News Agency, Nanjing, November 24 (Zou Ye, Zhang Kai) Weng Jinshun, who had organized smuggling activities 14 times, was sentenced to life imprisonment by the first trial of the Intermediate People&#39;s Court of Lianyungang City, Jiangsu Province, and two other &quot;snake heads&quot; Cui Shunjun and Lin Zhengqing They were each sentenced to 12 years in prison, and &quot;Snake Head&quot; Wang Yuedong was sentenced to 8 years in prison.	Sentence
267	267	Justice:Sentence	20	新华社南京１１月２４日电（邹煊　张凯）曾先后１４次组织偷渡 活动的“蛇头”翁金顺今天被江苏省连云港市中级人民法院一审判 处无期徒刑，另外２名“蛇头”崔顺军、林正清分别被判处有期徒 刑１２年，“蛇头”王月东被判处有期徒刑８年。	判处	19	20	Xinhua News Agency, Nanjing, November 24 (Zou Ye, Zhang Kai) Weng Jinshun, who had organized smuggling activities 14 times, was sentenced to life imprisonment by the first trial of the Intermediate People&#39;s Court of Lianyungang City, Jiangsu Province, and two other &quot;snake heads&quot; Cui Shunjun and Lin Zhengqing They were each sentenced to 12 years in prison, and &quot;Snake Head&quot; Wang Yuedong was sentenced to 8 years in prison.	Sentence
268	268	Justice:Sentence	20	新华社南京１１月２４日电（邹煊　张凯）曾先后１４次组织偷渡 活动的“蛇头”翁金顺今天被江苏省连云港市中级人民法院一审判 处无期徒刑，另外２名“蛇头”崔顺军、林正清分别被判处有期徒 刑１２年，“蛇头”王月东被判处有期徒刑８年。	判处	25	26	Xinhua News Agency, Nanjing, November 24 (Zou Ye, Zhang Kai) Weng Jinshun, who had organized smuggling activities 14 times, was sentenced to life imprisonment by the first trial of the Intermediate People&#39;s Court of Lianyungang City, Jiangsu Province, and two other &quot;snake heads&quot; Cui Shunjun and Lin Zhengqing They were each sentenced to 12 years in prison, and &quot;Snake Head&quot; Wang Yuedong was sentenced to 8 years in prison.	Sentence
269	269	Justice:Sentence	20	连云港市中级人民法院今天还一审分别判处“蛇头”陈守汉、史春 平有期徒刑４年，分别判处“蛇头”王月兵、万培成有期徒刑２年 、１年。	判处	0	1	The Lianyungang Intermediate People&#39;s Court also sentenced Chen Shouhan and Shi Chunping of the &quot;snake heads&quot; to four years in prison in the first instance and sentenced Wang Yuebing and Wan Peicheng of the &quot;snake heads&quot; to two years and one year respectively.	Sentence
270	270	Justice:Sentence	20	连云港市中级人民法院今天还一审分别判处“蛇头”陈守汉、史春 平有期徒刑４年，分别判处“蛇头”王月兵、万培成有期徒刑２年 、１年。	判处	9	10	The Lianyungang Intermediate People&#39;s Court also sentenced Chen Shouhan and Shi Chunping of the &quot;snake heads&quot; to four years in prison in the first instance and sentenced Wang Yuebing and Wan Peicheng of the &quot;snake heads&quot; to two years and one year respectively.	Sentence
271	271	Justice:Charge-Indict	2	拉奥是因涉嫌在１９９３年７月的一次不信任投票中犯有贿赂议员 罪而被送上法庭的。	送上	1	2	Rao was brought to court on suspicion of guilty of bribing members of Parliament in a vote of no confidence in July 1993.	Send
272	272	Justice:Charge-Indict	2	印尼总检察院是在８月上旬以苏哈托在执政期间利用他创立和经营 的７个基金会侵吞国家５．８亿美元向法院提出起诉的。	起诉	3	4	The Indonesian General Prosecutor&#39;s Office prosecuted the court in early August for the use of seven foundations established and operated by Suharto during the administration to embezzle $ 580 million of the country.	To sue
273	273	Justice:Appeal	5	法庭同时允许拉奥和辛格每人支付２０万卢比的保释金，将开始服 刑的时间推迟至１１月８日，以便于他们向德里高等法院上诉。	上诉	5	6	The court also allowed Rao and Singh each to pay a bail of 200,000 rupees, postponing the start of their sentence to November 8, to facilitate their appeal to the Delhi High Court.	appeal
274	274	Justice:Appeal	5	新华社圣地亚哥１２月２日电（记者侯耀其）智利前军政府领导人 皮诺切特的辩护律师团２日在这里向圣地亚哥上诉法院正式提起上 诉，要求推翻古斯曼法官１日签发的关于审判皮诺切特的决定。	"上
诉"	5	6	Xinhua News Agency, Santiago, December 2 (Reporter Hou Yaoqi) The defense lawyers of the former Chilean military government leader, Pinochet, formally appealed to the Santiago Court of Appeal on the 2nd, demanding that the trial issued by Judge Guzman on the 1st be overturned. Pinochet&#39;s decision.	appeal
275	275	Justice:Appeal	5	辩护律师团在上诉书中指出，他们认为，古斯曼法官签发审判皮诺 切特的决定是违犯规则的，应该予以纠正。	上诉	0	1	The defence counsel stated in the appeal that they considered that Judge Guzman&#39;s decision to issue a trial of Pinochet was against the rules and should be corrected.	appeal
276	276	Justice:Appeal	5	新华社圣地亚哥１２月１１日电（记者侯耀其）智利圣地亚哥上诉 法院第五庭１１日下午做出初审裁决，宣布接受前军政府领导人皮 诺切特辩护律师团提出的上诉，推翻古斯曼法官本月１日签发的关 于审判皮诺切特的决定。	上诉	8	9	Xinhua News Agency, Santiago, December 11 (Reporter Hou Yaoqi) The Fifth Chamber of the Santiago Court of Appeal, Chile, issued a preliminary ruling on the afternoon of the 11th, announcing the acceptance of an appeal by the former military government leader Pinochet Defence Counsel and overturning Judge Guzman. A decision on the trial of Pinochet issued on the 1st of this month.	appeal
277	277	Justice:Appeal	5	新华社华盛顿１１月２４日电（记者刘江　胡晓明）美国联邦最高 法院２４日下午宣布，该院已决定受理共和党总统候选人布什对佛 罗里达州最高法院关于人工重新计票结果有效的判决提出的上诉， 并将于１２月１日就这一问题举行听证会。	上诉	9	10	Xinhua News Agency, Washington, November 24 (Reporter Liu Jianghu Xiaoming) The U.S. Supreme Court announced on the afternoon of the 24th that the U.S. Supreme Court has decided to accept the appeal of the Republican presidential candidate Bush against the Florida Supreme Court&#39;s verdict that the validity of the manual recount is valid A hearing on this issue will be held on December 1.	appeal
278	278	Transaction:Transfer-Money	24	法庭同时允许拉奥和辛格每人支付２０万卢比的保释金，将开始服 刑的时间推迟至１１月８日，以便于他们向德里高等法院上诉。	支付	0	1	The court also allowed Rao and Singh each to pay a bail of 200,000 rupees, postponing the start of their sentence to November 8, to facilitate their appeal to the Delhi High Court.	Pay
279	279	Transaction:Transfer-Money	24	新华社南京１０月１７日电（汤征　张明军）组织他人非法出境的 韩国“蛇头”张济洪昨天被镇江市中级人民法院判处驱逐出境，并 处以１０万元人民币罚金。	处	13	14	Xinhua News Agency, Nanjing, October 17 (Tang Zheng Zhang Mingjun) Zhang Jihong, a South Korean &quot;snake head&quot; who organized an illegal exit, was sentenced to deportation by the Zhenjiang Intermediate People&#39;s Court and fined 100,000 yuan.	Place
280	280	Transaction:Transfer-Money	24	与张济洪共同策划组织偷渡活动的中国“蛇头”郑德龙被判处有期 徒刑７年，剥夺政治权利１年，并处罚金５万元；女“蛇头”申明 哲被判处有期徒刑１年，并处罚金５万元。	处	9	10	Zheng Delong, a Chinese &quot;snake head&quot; who co-planned with Zhang Jihong to organize a smuggling event, was sentenced to 7 years in prison, deprived of political rights for 1 year, and fined 50,000 yuan; the female &quot;snake head&quot; Shen Zhe was sentenced to 1 year in prison and fined 5 Ten thousand yuan.	Place
281	281	Transaction:Transfer-Money	24	与张济洪共同策划组织偷渡活动的中国“蛇头”郑德龙被判处有期 徒刑７年，剥夺政治权利１年，并处罚金５万元；女“蛇头”申明 哲被判处有期徒刑１年，并处罚金５万元。	处	18	19	Zheng Delong, a Chinese &quot;snake head&quot; who co-planned with Zhang Jihong to organize a smuggling event, was sentenced to 7 years in prison, deprived of political rights for 1 year, and fined 50,000 yuan; the female &quot;snake head&quot; Shen Zhe was sentenced to 1 year in prison and fined 5 Ten thousand yuan.	Place
282	282	Transaction:Transfer-Money	24	新华社东京１１月１０日电（记者王大军）日本秋田地方法院１０ 日判处邪教组织“法之华三法行”向秋田市一妇女作出５５０万日 元的赔偿。	赔偿	10	11	Xinhua News Agency, Tokyo, November 10 (Reporter Wang Dajun) Japan&#39;s Akita District Court sentenced the cult organization &quot;Three Laws of the Law&quot; to compensate a woman in Akita for 5.5 million yen.	Compensation
283	283	Transaction:Transfer-Money	24	法庭认为，“法之华三法行”劝人参加研修和捐款活动并非纯粹为 了布教，而是以恶劣的手段敛财，属于有组织的不法行为，因此须 向受害者作出赔偿。	捐款	5	6	The court held that the &quot;Three Laws of the Law&quot; persuading people to participate in training and donation activities is not purely for teaching, but for accumulating money by bad means. It is an organized wrongdoing, so compensation must be paid to the victims.	Donate
284	284	Transaction:Transfer-Money	24	法庭认为，“法之华三法行”劝人参加研修和捐款活动并非纯粹为 了布教，而是以恶劣的手段敛财，属于有组织的不法行为，因此须 向受害者作出赔偿。	赔偿	13	14	The court held that the &quot;Three Laws of the Law&quot; persuading people to participate in training and donation activities is not purely for teaching, but for accumulating money by bad means. It is an organized wrongdoing, so compensation must be paid to the victims.	Compensation
285	285	Transaction:Transfer-Money	24	南宁市中级人民法院确认，被告人佘国信身为国家工作人员，利用 职务之便为他人谋利益，非法收受他人财物达１８８．５万元人民 币，数额特别巨大，情节特别严重。	收受	7	8	The Nanning Intermediate People&#39;s Court confirmed that the defendant, Guo Guoxin, was a national staff member and used his position to seek benefits for others. He illegally accepted other people&#39;s property amounting to RMB 18.85 million, a particularly large amount and a particularly serious case.	Accept
286	286	Transaction:Transfer-Money	24	新华社东京１１月１３日电（记者王妍）日本大阪地方法院１３日 作出判决，要求以毫无科学根据的脚相诊断为手段骗取钱财的邪教 “法之华三法行”，对大阪府１６名受骗男子赔偿总共１．１亿日 元。	赔偿	12	13	Xinhua News Agency, Tokyo, November 13th (Reporter Wang Yan) The Osaka District Court of Japan issued a ruling on the 13th, demanding that the cult &quot;Three Acts of Law&quot; to defraud money by means of unscientific telegraph diagnosis as a means of defrauding Osaka Prefecture. The 16 cheated men paid a total of 110 million yen.	Compensation
287	287	Transaction:Transfer-Money	24	这些男子在向法院提出的财产赔偿诉讼中说，从１９９２年开始， “法之华三法行”教团成员以看脚相的方式，恐吓他们已身患癌症 ，骗取了２０万至３０００万日元不等的“研修费”。	骗取	11	12	In a property compensation lawsuit filed by the courts, these men said that since 1992, members of the &quot;Three Laws of Law&quot; sect have threatened them with cancer by looking at them, defrauding 200,000 to 30 million people. &quot;Training fees&quot; in yen.	cheat
288	288	Transaction:Transfer-Money	24	另外，在中国政府的带头号召下，中国民间也掀起了一场前所未见 的捐款热潮，社会各界人士慷慨解囊，媒体上也充满了好人好事的 新闻：在北京，一名78岁的老太太将手头上仅有的1800元人 民币现金捐出；有81个贫困山区的小学生从拮据的生活费中每人 拿出1元人民币，托老师寄给灾区；据说在辽宁的捐款者当中，还 包括了不少失业人士和下岗工人。	捐出	15	16	In addition, under the leadership of the Chinese government, the Chinese people have also launched an unprecedented wave of donations, people from all walks of life have generously donated money, and the media is full of good news. In Beijing, a 78-year-old The wife donated only 1,800 yuan in cash on hand; elementary school students in 81 poor mountainous areas took out 1 yuan each from the cost of living and entrusted the teacher to send to the disaster area; among the donors in Liaoning, it is said Many unemployed and laid-off workers.	Donate
289	289	Transaction:Transfer-Money	24	另外，在中国政府的带头号召下，中国民间也掀起了一场前所未见 的捐款热潮，社会各界人士慷慨解囊，媒体上也充满了好人好事的 新闻：在北京，一名78岁的老太太将手头上仅有的1800元人 民币现金捐出；有81个贫困山区的小学生从拮据的生活费中每人 拿出1元人民币，托老师寄给灾区；据说在辽宁的捐款者当中，还 包括了不少失业人士和下岗工人。	拿出	18	19	In addition, under the leadership of the Chinese government, the Chinese people have also launched an unprecedented wave of donations, people from all walks of life have generously donated money, and the media is full of good news. In Beijing, a 78-year-old The wife donated only 1,800 yuan in cash on hand; elementary school students in 81 poor mountainous areas took out 1 yuan each from the cost of living and entrusted the teacher to send to the disaster area; among the donors in Liaoning, it is said Many unemployed and laid-off workers.	Take out
290	290	Transaction:Transfer-Money	24	另外，在中国政府的带头号召下，中国民间也掀起了一场前所未见 的捐款热潮，社会各界人士慷慨解囊，媒体上也充满了好人好事的 新闻：在北京，一名78岁的老太太将手头上仅有的1800元人 民币现金捐出；有81个贫困山区的小学生从拮据的生活费中每人 拿出1元人民币，托老师寄给灾区；据说在辽宁的捐款者当中，还 包括了不少失业人士和下岗工人。	捐款	5	6	In addition, under the leadership of the Chinese government, the Chinese people have also launched an unprecedented wave of donations, people from all walks of life have generously donated money, and the media is full of good news. In Beijing, a 78-year-old The wife donated only 1,800 yuan in cash on hand; elementary school students in 81 poor mountainous areas took out 1 yuan each from the cost of living and entrusted the teacher to send to the disaster area; among the donors in Liaoning, it is said Many unemployed and laid-off workers.	Donate
291	291	Transaction:Transfer-Money	24	另外，在中国政府的带头号召下，中国民间也掀起了一场前所未见 的捐款热潮，社会各界人士慷慨解囊，媒体上也充满了好人好事的 新闻：在北京，一名78岁的老太太将手头上仅有的1800元人 民币现金捐出；有81个贫困山区的小学生从拮据的生活费中每人 拿出1元人民币，托老师寄给灾区；据说在辽宁的捐款者当中，还 包括了不少失业人士和下岗工人。	慷慨解囊	7	8	In addition, under the leadership of the Chinese government, the Chinese people have also launched an unprecedented wave of donations, people from all walks of life have generously donated money, and the media is full of good news. In Beijing, a 78-year-old The wife donated only 1,800 yuan in cash on hand; elementary school students in 81 poor mountainous areas took out 1 yuan each from the cost of living and entrusted the teacher to send to the disaster area; among the donors in Liaoning, it is said Many unemployed and laid-off workers.	Generous
292	292	Transaction:Transfer-Money	24	网民说，在外国，捐款经常是通过电话热线、街头募捐等方式进行 的，捐款人自发性比较强，但中国现在主要的募捐手法却是由政府 机关和事业单位动员雇员捐款，谁捐了多少上级一清二楚，结果一 些不愿意捐助者在压力下，也不得不有一些象征性的表示。	捐款	4	5	Netizens said that in foreign countries, donations are often made through telephone hotlines and street fundraising. Donors are relatively spontaneous. However, the main fundraising method in China now is to mobilize employees to donate by government agencies and institutions. Who donates much? The superior was clear, and as a result, some unwilling donors had to make some symbolic expressions under pressure.	Donate
293	293	Transaction:Transfer-Money	24	网民说，在外国，捐款经常是通过电话热线、街头募捐等方式进行 的，捐款人自发性比较强，但中国现在主要的募捐手法却是由政府 机关和事业单位动员雇员捐款，谁捐了多少上级一清二楚，结果一 些不愿意捐助者在压力下，也不得不有一些象征性的表示。	捐款	12	13	Netizens said that in foreign countries, donations are often made through telephone hotlines and street fundraising. Donors are relatively spontaneous. However, the main fundraising method in China now is to mobilize employees to donate by government agencies and institutions. Who donates much? The superior was clear, and as a result, some unwilling donors had to make some symbolic expressions under pressure.	Donate
294	294	Transaction:Transfer-Money	24	网民说，在外国，捐款经常是通过电话热线、街头募捐等方式进行 的，捐款人自发性比较强，但中国现在主要的募捐手法却是由政府 机关和事业单位动员雇员捐款，谁捐了多少上级一清二楚，结果一 些不愿意捐助者在压力下，也不得不有一些象征性的表示。	捐	14	15	Netizens said that in foreign countries, donations are often made through telephone hotlines and street fundraising. Donors are relatively spontaneous. However, the main fundraising method in China now is to mobilize employees to donate by government agencies and institutions. Who donates much? The superior was clear, and as a result, some unwilling donors had to make some symbolic expressions under pressure.	donate
295	295	Transaction:Transfer-Money	24	网民说，在外国，捐款经常是通过电话热线、街头募捐等方式进行 的，捐款人自发性比较强，但中国现在主要的募捐手法却是由政府 机关和事业单位动员雇员捐款，谁捐了多少上级一清二楚，结果一 些不愿意捐助者在压力下，也不得不有一些象征性的表示。	表示	19	20	Netizens said that in foreign countries, donations are often made through telephone hotlines and street fundraising. Donors are relatively spontaneous. However, the main fundraising method in China now is to mobilize employees to donate by government agencies and institutions. Who donates much? The superior was clear, and as a result, some unwilling donors had to make some symbolic expressions under pressure.	Express
296	296	Transaction:Transfer-Money	24	"中国官方把援助追加到6200万美元以后，《纽约时报》却仍要 以美国和日本分别捐出3亿5000万美元和5亿美元作比较，来 说明中国""这个世界上人口最多的国家离当亚洲老大的日子还远着 ""。"	追加	0	1	After China ’s official aid was increased to US $ 62 million, the New York Times still compared the US and Japan ’s donations of US $ 350 million and US $ 500 million, respectively, to show that China ’s “world ’s most populous country ’s departure” The days of the Asian boss are still far away. &quot;	add to
297	297	Transaction:Transfer-Money	24	"中国官方把援助追加到6200万美元以后，《纽约时报》却仍要 以美国和日本分别捐出3亿5000万美元和5亿美元作比较，来 说明中国""这个世界上人口最多的国家离当亚洲老大的日子还远着 ""。"	捐出	6	7	After China ’s official aid was increased to US $ 62 million, the New York Times still compared the US and Japan ’s donations of US $ 350 million and US $ 500 million, respectively, to show that China ’s “world ’s most populous country ’s departure” The days of the Asian boss are still far away. &quot;	Donate
